{
  "schema_version": 3,
  "job_id": "4b7c2e19-3d5a-4f81-9c06-8e1b2a7d5f30",
  "match_id": "2026casf_qm43",
  "season": 2026,
  "video_id": "kJQP7kiw5Fk",
  "local_path": "/data/segments/kJQP7kiw5Fk_00000_00162.mp4",
  "start_offset": 0,
  "duration": 162,
  "fps": 30,
  "width": 640,
  "height": 360,
  "status": "complete",
  "stage": null,
  "progress": null,
  "error_code": null,
  "error": null,
  "attempt": 1,
  "created_at": "2026-08-28T15:02:00Z",
  "updated_at": "2026-08-28T15:07:44Z",
  "alliances": null,
  "tba_score": null
}
