{
  "schema_version": 3,
  "job_id": "f81d4fae-7dec-11d0-a765-00a0c91e6bf6",
  "match_id": "2026casf_qm42",
  "season": 2026,
  "video_id": "dQw4w9WgXcQ",
  "local_path": "/data/segments/dQw4w9WgXcQ_00120_00282.mp4",
  "start_offset": 120,
  "duration": 162,
  "fps": 30,
  "width": 640,
  "height": 360,
  "status": "complete",
  "stage": null,
  "progress": null,
  "error_code": null,
  "error": null,
  "attempt": 1,
  "created_at": "2026-08-28T14:20:00Z",
  "updated_at": "2026-08-28T14:26:04Z",
  "alliances": {
    "red": [
      254,
      1678,
      971
    ],
    "blue": [
      118,
      148,
      2056
    ]
  },
  "tba_score": {
    "red": 91,
    "blue": 84
  }
}
